{
  "schema_version": "1.0",
  "task_slug": "kontourai-flow-agents-287",
  "repo": "kontourai/flow-agents",
  "status": "accepted",
  "phase": "learning",
  "created_at": "2026-07-02T19:50:44Z",
  "updated_at": "2026-07-02T22:40:06Z",
  "artifact_paths": [
    "acceptance.json",
    "kontourai-flow-agents-287--deliver.md",
    "learning.json",
    "state.json"
  ],
  "next_action": {
    "status": "continue",
    "summary": "287 delivered clean after 2 fix iterations; process learnings routed"
  }
}
